id,title,score,num_comments,author,created_utc,url,over_18,edited,spoiler,stickied
1ljq8r4,Unit tests != data quality checks. CMV.,117,16,EarthGoddessDude,2025-06-24 23:20:59,https://www.reddit.com/r/dataengineering/comments/1ljq8r4/unit_tests_data_quality_checks_cmv/,False,True,False,False
1ljblwa,Want to learn Pyspark but videos are boaring for me,48,23,According-Mud-6472,2025-06-24 13:49:10,https://www.reddit.com/r/dataengineering/comments/1ljblwa/want_to_learn_pyspark_but_videos_are_boaring_for/,False,True,False,False
1lj7ws8,Is data mesh and data fabric a real thing?,47,32,thepenetrator,2025-06-24 10:50:24,https://www.reddit.com/r/dataengineering/comments/1lj7ws8/is_data_mesh_and_data_fabric_a_real_thing/,False,True,False,False
1ljmd4d,"We just released Firebolt Core - a free, self-hosted OLAP engine (debuting in the #1 spot on ClickBench)",30,4,FireboltCole,2025-06-24 20:40:30,https://www.reddit.com/r/dataengineering/comments/1ljmd4d/we_just_released_firebolt_core_a_free_selfhosted/,False,True,False,False
1ljhmh1,"Is our Azure-based data pipeline too simple, or just pragmatic",28,25,No-Interest5101,2025-06-24 17:39:54,https://www.reddit.com/r/dataengineering/comments/1ljhmh1/is_our_azurebased_data_pipeline_too_simple_or/,False,True,False,False
1ljfxww,How can I enforce read-only SQL queries in Spark Connect?,12,6,Certain_Leader9946,2025-06-24 16:36:40,https://www.reddit.com/r/dataengineering/comments/1ljfxww/how_can_i_enforce_readonly_sql_queries_in_spark/,False,True,False,False
1ljfuuq,"How to handle working at a company with great potential, but huge legacy?",11,7,TallestTurtleInTown,2025-06-24 16:33:32,https://www.reddit.com/r/dataengineering/comments/1ljfuuq/how_to_handle_working_at_a_company_with_great/,False,True,False,False
1ljd11a,Certification prep Databricks Data Engineer,12,7,sa_ya07,2025-06-24 14:46:24,https://www.reddit.com/r/dataengineering/comments/1ljd11a/certification_prep_databricks_data_engineer/,False,True,False,False
1ljlzxt,Chuck Data - Agentic Data Engineering CLI for Databricks (Feedback requested),9,2,caleb-amperity,2025-06-24 20:26:05,https://www.reddit.com/r/dataengineering/comments/1ljlzxt/chuck_data_agentic_data_engineering_cli_for/,False,True,False,False
1ljhw19,Is Lakehouse making Data Vault obsolete?,8,9,Dry-Aioli-6138,2025-06-24 17:49:44,https://www.reddit.com/r/dataengineering/comments/1ljhw19/is_lakehouse_making_data_vault_obsolete/,False,True,False,False
1ljgjmd,Confused about the direction and future of my career as a data engineer,8,5,thro0away12,2025-06-24 16:59:59,https://www.reddit.com/r/dataengineering/comments/1ljgjmd/confused_about_the_direction_and_future_of_my/,False,True,False,False
1ljhto5,Data quality/monitoring,5,3,IAmBeary,2025-06-24 17:47:13,https://www.reddit.com/r/dataengineering/comments/1ljhto5/data_qualitymonitoring/,False,True,False,False
1lj7iw5,How to crack senior data roles at FAANG companies ?,7,6,_Dark_Invader_,2025-06-24 10:27:14,https://www.reddit.com/r/dataengineering/comments/1lj7iw5/how_to_crack_senior_data_roles_at_faang_companies/,False,True,False,False
1ljsy5p,Whats your Data Stack for Takehomes?,6,5,TacoTuesday69_420,2025-06-25 01:28:45,https://www.reddit.com/r/dataengineering/comments/1ljsy5p/whats_your_data_stack_for_takehomes/,False,True,False,False
1ljlx86,Feeling bad about todays tech screening with amazon for BIE,7,9,Cheeezzzyy,2025-06-24 20:23:04,https://www.reddit.com/r/dataengineering/comments/1ljlx86/feeling_bad_about_todays_tech_screening_with/,False,True,False,False
1lj5k6f,Any data managers here uses CKAN for their internal data hubs and open data portals?,6,0,MultiPotentialite89,2025-06-24 08:20:55,http://ckan.org,False,True,False,False
1ljk4pi,Roles that involve audio?,3,2,SIumped,2025-06-24 19:13:54,https://www.reddit.com/r/dataengineering/comments/1ljk4pi/roles_that_involve_audio/,False,True,False,False
1ljl4eq,Top Lists Compilation,2,0,NowYouShallSee,2025-06-24 19:52:01,https://www.reddit.com/r/dataengineering/comments/1ljl4eq/top_lists_compilation/,False,True,False,False
1ljwjaw,Curious about next steps as a mid career DE: Cert or Projects,1,0,hijkblck93,2025-06-25 04:34:27,https://www.reddit.com/r/dataengineering/comments/1ljwjaw/curious_about_next_steps_as_a_mid_career_de_cert/,False,True,False,False
1ljwhsq,Data Engineer Looking to Upskill in GenAI — Anyone Tried Summit Mittal’s Course?,1,6,Physical_Shelter_285,2025-06-25 04:32:06,https://www.reddit.com/r/dataengineering/comments/1ljwhsq/data_engineer_looking_to_upskill_in_genai_anyone/,False,True,False,False
1ljcpca,Where to Store Master Data for Internal Billing Catalogs in GCP?,1,0,Ill_Space6773,2025-06-24 14:33:32,https://www.reddit.com/r/dataengineering/comments/1ljcpca/where_to_store_master_data_for_internal_billing/,False,True,False,False
1ljte6w,"do you load data from ETL system to both database and storage? if yes, what kind of data you load to storage?",0,9,BBHUHUH,2025-06-25 01:50:34,https://www.reddit.com/r/dataengineering/comments/1ljte6w/do_you_load_data_from_etl_system_to_both_database/,False,True,False,False
1lj8r6s,Palantir platform - is it popular?,0,5,Astherol,2025-06-24 11:36:36,https://www.reddit.com/r/dataengineering/comments/1lj8r6s/palantir_platform_is_it_popular/,False,True,False,False
1ljk8pn,Data engineers getting wrecked by schema changes - would you pay for this?,0,3,Zestyclose-Lynx-1796,2025-06-24 19:17:55,https://www.reddit.com/r/dataengineering/comments/1ljk8pn/data_engineers_getting_wrecked_by_schema_changes/,False,True,False,False
